{
  "$schema": "https://json-schema.org/draft/2020-12/schema",
  "$id": "https://ai-native-methodology/schemas/behavior-spec.schema.json",
  "title": "Behavior Spec (chain 2 / 동작 명세)",
  "description": "v2.0 chain harness 의 spec stage 핵심 산출물. Phase 4.5 산출물 (state-machine / sequence / decision-table / invariant / property-test) 의 spec stage 격상 + discovery-spec.use_cases 흡수. executable behavioral contract. DEC-2026-05-06-v2.0-i-strict-채택 정합. v11.0.0 MAJOR — derivation_source.discovery_spec_path rename (DEC-2026-05-26-discovery-spec-rename / planning_spec_path 폐기).",
  "type": "object",
  "required": ["meta", "derivation_source", "behaviors"],
  "additionalProperties": false,
  "properties": {
    "meta": {
      "$ref": "./meta-confidence.schema.json"
    },
    "derivation_source": {
      "type": "object",
      "required": ["discovery_spec_path", "analysis_artifacts"],
      "additionalProperties": false,
      "properties": {
        "discovery_spec_path": {
          "type": "string",
          "description": "v11.0.0 rename — 본 behavior-spec 추출의 discovery-spec.json 경로 (chain discovery backward link). 이전 명명 `planning_spec_path` 본격 폐기 (DEC-2026-05-26-discovery-spec-rename)."
        },
        "analysis_artifacts": {
          "type": "array",
          "items": {"type": "string"},
          "minItems": 1,
          "description": "analysis stage 산출물 경로 (business-rules.json / domain.json / openapi.yaml / 8 FE 산출물 / Phase 4.5)"
        }
      }
    },
    "behaviors": {
      "type": "array",
      "minItems": 1,
      "description": "BHV-* 목록. 각 BHV 는 ≥ 1 UC-* backward link + ≥ 1 AC-* forward link 의무",
      "items": {
        "type": "object",
        "required": ["id", "use_case_refs", "acceptance_criteria_refs"],
        "additionalProperties": false,
        "properties": {
          "id": {
            "type": "string",
            "pattern": "^BHV-[A-Z0-9_-]+-[0-9]{3}$",
            "description": "Behavior ID (예: BHV-USER-001)"
          },
          "name": {"type": "string"},
          "description": {"type": "string"},
          "use_case_refs": {
            "type": "array",
            "items": {"type": "string", "pattern": "^UC-[A-Z0-9_-]+-[0-9]{3}$"},
            "minItems": 1,
            "description": "discovery-spec backward link 의무 (chain-coverage-validator 강제 / v11.0.0 — planning-spec → discovery-spec rename)"
          },
          "br_refs": {
            "type": "array",
            "items": {"type": "string", "pattern": "^BR-[A-Z0-9_-]+-[A-Z0-9_-]+-[0-9]+$"},
            "description": "analysis stage business-rules.json BR-* backward link"
          },
          "unit_refs": {
            "type": "array",
            "items": {"type": "string", "pattern": "^UNIT-[A-Z0-9_-]+-[0-9]{3}$"},
            "uniqueItems": true,
            "description": "v0.36.0 신설 (DEC-2026-06-11-tdd-unit-layer-thread). 본 BHV 가 조합(compose)하는 빌딩블록 UNIT-* (unit-spec.json). TDD/unit 층과 behavior 층의 join — composition TC 가 어떤 UNIT 을 mock 하는지 추적. optional/additive — 부재 = behavior-only mode 정상."
          },
          "preconditions": {
            "type": "array",
            "items": {"type": "string"},
            "description": "formal expressions (e.g., \"user.status == ACTIVE\")"
          },
          "postconditions": {
            "type": "array",
            "items": {"type": "string"}
          },
          "invariants": {
            "type": "array",
            "items": {"type": "string"}
          },
          "state_transition_ref": {
            "type": "string",
            "description": "Phase 4.5 state-machine.json 경로 (.ai-context/output/formal-spec/state-machines/{id}.json)"
          },
          "decision_table_ref": {
            "type": "string",
            "description": "Phase 4.5 decision-table.json 경로"
          },
          "sequence_ref": {
            "type": "string",
            "description": "Phase 4.5 sequence.json 경로"
          },
          "property_tests": {
            "type": "array",
            "description": "property-based test stub (fast-check / Hypothesis / jqwik) — Industry research 권고",
            "items": {
              "type": "object",
              "required": ["property", "framework"],
              "additionalProperties": false,
              "properties": {
                "property": {"type": "string", "description": "검증 property 자연어 또는 코드"},
                "framework": {"type": "string", "enum": ["fast-check", "hypothesis", "jqwik", "quickcheck", "proptest", "other"]},
                "framework_status": {
                  "type": "string",
                  "enum": ["active", "maintenance", "deprecated"],
                  "description": "Industry — jqwik 같은 maintenance mode 경고 (B3)"
                },
                "arbitrary_stub": {"type": "string", "description": "fast-check arbitrary 구조 stub"}
              }
            }
          },
          "acceptance_criteria_refs": {
            "type": "array",
            "items": {"type": "string", "pattern": "^AC-[A-Z0-9_-]+-[0-9]{3}$"},
            "minItems": 1,
            "description": "forward link 의무 (chain-coverage-validator 강제)"
          },
          "source_grounded_evidence": {
            "type": "array",
            "items": {"type": "string"},
            "description": "no-simulation — analysis 산출물 / 코드 경로"
          },
          "code_pointers": {
            "type": "array",
            "description": "operation.md 결정 3 + P2 — artifact ↔ code anchor. graph-synthesizer 가 평탄화 / code-pointer-validator 가 검증.",
            "items": {"$ref": "./code-pointer.schema.json"}
          },
          "code_pointers_na": {
            "type": "boolean",
            "default": false,
            "description": "명시적 N/A 마커 (operation.md 결정 3)."
          }
        }
      }
    },
    "cross_links": {
      "type": "object",
      "description": "DO-178C bidirectional + analysis 산출물 통합 (사용자 답변 3 정합)",
      "additionalProperties": false,
      "properties": {
        "to_analysis_artifacts": {
          "type": "array",
          "items": {"type": "string"},
          "description": "산출물 reference 의무 — chain-coverage-validator 가 모두 reference 강제 (사용자 답변 3 \"기존 산출물 + 신규 추가\" 정합)"
        }
      }
    }
  }
}
